{
  "$schema": "https://json-schema.org/draft/2020-12/schema",
  "$id": "https://newsdash.invalid/schema/preset.schema.json",
  "title": "Personal Newsdash preset pack",
  "type": "object",
  "required": ["id", "name", "category", "section", "sources"],
  "additionalProperties": false,
  "properties": {
    "$schema": { "type": "string" },
    "id": { "type": "string", "pattern": "^[a-z0-9-]{2,64}$" },
    "name": {
      "type": "object",
      "required": ["en", "zh"],
      "additionalProperties": false,
      "properties": {
        "en": { "type": "string", "minLength": 1 },
        "zh": { "type": "string", "minLength": 1 }
      }
    },
    "category": { "enum": ["open", "optional"] },
    "section": { "type": "string", "pattern": "^[a-z0-9_-]{2,32}$" },
    "sources": {
      "type": "array",
      "minItems": 1,
      "items": { "$ref": "https://newsdash.invalid/schema/sources.schema.json#/$defs/source" }
    },
    "tag_rules": {
      "type": "array",
      "items": {
        "type": "object",
        "required": ["tag", "any"],
        "additionalProperties": false,
        "properties": {
          "tag": { "type": "string", "pattern": "^[a-z0-9-]{2,32}$" },
          "any": { "type": "array", "minItems": 1, "items": { "type": "string", "minLength": 1 } }
        }
      }
    }
  }
}
